{"$id":"https://github.com/HeavenzFire/Muse-Capsule/interchange/browser-connector/browser_result.schema.json","$schema":"https://json-schema.org/draft/2020-12/schema","description":"Muse's verified report of a browser run, carried by HeavenzFire Interchange v1. This package is the ONLY proof a browser action happened. A request package alone proves nothing. Every claim carries evidence or is listed under unresolved. IDs and messages are verbatim from the site.","properties":{"checked":{"description":"What was actually checked or done, step by step, in the live session or fetch. Distinguish 'read the terms page' from 'signed in and read the account page'.","items":{"type":"string"},"minItems":1,"type":"array"},"confirmations":{"description":"Empty array means the site issued no confirmation — which for purchase/send actions means the action is NOT established.","items":{"properties":{"kind":{"description":"e.g. order_id, tracking_number, total_charged, mailing_date, account_name, confirmation_text.","type":"string"},"value":{"description":"Verbatim from the site. Never reconstructed, rounded, or inferred.","type":"string"}},"required":["kind","value"],"type":"object"},"type":"array"},"evidence":{"items":{"properties":{"basis":{"description":"search_snippet is the weakest basis and cannot establish live availability, prices, or account state.","enum":["live_session","page_text_fetch","search_snippet","connector"],"type":"string"},"claim":{"type":"string"},"source_url":{"description":"Exact URL the claim rests on, copied verbatim from the session/search result.","type":"string"}},"required":["claim","source_url","basis"],"type":"object"},"type":"array"},"failures":{"items":{"properties":{"message":{"description":"The site's exact error message where one exists, quoted. If the failure was a dead session / no response, say exactly that — do not invent a site message.","type":"string"},"step":{"type":"string"}},"required":["step","message"],"type":"object"},"type":"array"},"kind":{"const":"browser_result","type":"string"},"permissions":{"properties":{"credentials_in_packages":{"const":false,"type":"boolean"},"irreversibles_require_user_word":{"const":true,"type":"boolean"},"notes":{"type":"string"}},"required":["irreversibles_require_user_word","credentials_in_packages"],"type":"object"},"project_id":{"description":"Interchange v1 field, carried unchanged.","minLength":1,"type":"string"},"request_id":{"description":"Echoes the request package's request_id verbatim. A result that cannot be matched to a request is not trusted.","minLength":1,"type":"string"},"schema_version":{"const":"1.0.0","type":"string"},"source_platform":{"const":"meta-ai-muse","description":"Results are always produced by Muse, the side that ran the browser.","type":"string"},"status":{"description":"unknown is mandatory when a session died / no result came back: a dead session may or may not have committed, and must be re-checked state-first before any retry.","enum":["completed","partial","blocked","failed","unknown"],"type":"string"},"timestamp":{"format":"date-time","type":"string"},"unresolved":{"description":"Anything still open: questions the browser asked that weren't answered, approvals still pending, fields the site did not show.","items":{"type":"string"},"type":"array"}},"required":["schema_version","kind","request_id","project_id","source_platform","status","checked","evidence","confirmations","unresolved","failures","permissions","timestamp"],"title":"Browser Result Package (Muse -> GPT)","type":"object"}