{"checked":["Fetched the page text of https://Muse.ai/terms (signed-out text fetch; no sign-in, no live browser session needed).","Located the arbitration opt-out provision in the terms and read the operative sentence in full.","Confirmed the operating entity named in the terms is Meta Platforms, Inc. before relying on the text (entity-verification step, CONNECTOR.md)."],"confirmations":[{"kind":"terms_text_checked","value":"opt-out provision read verbatim from https://Muse.ai/terms on 2026-10-22 (example package — illustrates the result format)"}],"evidence":[{"basis":"page_text_fetch","claim":"The terms specify opt-out by sending the required details to a postal address — Meta Platforms, Inc. ATTN: Muse Arbitration Opt-out, 1601 Willow Rd., Menlo Park, CA 94025 — within 30 days of agreeing to the Terms. No email opt-out method is specified.","source_url":"https://Muse.ai/terms"}],"failures":[],"kind":"browser_result","permissions":{"credentials_in_packages":false,"irreversibles_require_user_word":true,"notes":"Read-only result. Nothing was signed into, sent, or paid."},"project_id":"heavenzfire-unified-field","request_id":"br-20261022-check-meta-muse-optout-terms","schema_version":"1.0.0","source_platform":"meta-ai-muse","status":"completed","timestamp":"2026-10-22T17:53:00-05:00","unresolved":[]}